{
  "additionalProperties": false,
  "description": "一筆 v1 量測；驗證欄位，不代表已核對 Topic 或完成持久儲存。",
  "properties": {
    "schema_version": {
      "const": 1,
      "title": "Schema Version",
      "type": "integer"
    },
    "message_id": {
      "format": "uuid",
      "pattern": "^[0-9a-f]{8}-[0-9a-f]{4}-4[0-9a-f]{3}-[89ab][0-9a-f]{3}-[0-9a-f]{12}$",
      "title": "Message Id",
      "type": "string"
    },
    "device_id": {
      "maxLength": 64,
      "minLength": 1,
      "pattern": "^[a-z0-9]+(?:-[a-z0-9]+)*$",
      "title": "Device Id",
      "type": "string"
    },
    "gateway_id": {
      "maxLength": 64,
      "minLength": 1,
      "pattern": "^[a-z0-9]+(?:-[a-z0-9]+)*$",
      "title": "Gateway Id",
      "type": "string"
    },
    "acquired_at": {
      "format": "date-time",
      "pattern": "^\\d{4}-\\d{2}-\\d{2}T\\d{2}:\\d{2}:\\d{2}(?:\\.\\d{1,6})?(?:Z|\\+00:00)$",
      "title": "Acquired At",
      "type": "string"
    },
    "raw_registers": {
      "items": {
        "maximum": 65535,
        "minimum": 0,
        "type": "integer"
      },
      "maxItems": 5,
      "minItems": 5,
      "title": "Raw Registers",
      "type": "array"
    },
    "measurement": {
      "$ref": "#/definitions/Measurement"
    }
  },
  "required": [
    "schema_version",
    "message_id",
    "device_id",
    "gateway_id",
    "acquired_at",
    "raw_registers",
    "measurement"
  ],
  "title": "SIM-POWER-01 telemetry v1",
  "type": "object",
  "definitions": {
    "Measurement": {
      "additionalProperties": false,
      "description": "四項量測；上下限來自編碼能力，不是正常工作範圍。",
      "properties": {
        "voltage_v": {
          "description": "電壓 V，word0 / 10。",
          "maximum": 6553.5,
          "minimum": 0,
          "title": "Voltage V",
          "type": "number"
        },
        "current_a": {
          "description": "電流 A，word1 / 100。",
          "maximum": 655.35,
          "minimum": 0,
          "title": "Current A",
          "type": "number"
        },
        "power_w": {
          "description": "有功功率 W，word2。",
          "maximum": 65535,
          "minimum": 0,
          "title": "Power W",
          "type": "integer"
        },
        "energy_wh": {
          "description": "累積電量 Wh，word3 * 65536 + word4。",
          "maximum": 4294967295,
          "minimum": 0,
          "title": "Energy Wh",
          "type": "integer"
        }
      },
      "required": [
        "voltage_v",
        "current_a",
        "power_w",
        "energy_wh"
      ],
      "title": "Measurement",
      "type": "object"
    }
  },
  "$schema": "http://json-schema.org/draft-07/schema#",
  "examples": [
    {
      "schema_version": 1,
      "message_id": "c9042acf-7361-4d21-8840-85033021f201",
      "device_id": "meter-001",
      "gateway_id": "gateway-001",
      "acquired_at": "2026-10-22T01:00:00.000000Z",
      "raw_registers": [
        2300,
        1000,
        2300,
        1,
        4464
      ],
      "measurement": {
        "voltage_v": 230.0,
        "current_a": 10.0,
        "power_w": 2300,
        "energy_wh": 70000
      }
    }
  ]
}
